doc_key,chunk_index,entities,latency,input_tokens,output_tokens,processed_entities
383,0,News Online Today; ELODIS; 2005/09/25; Kronos; Protectors of Kronos; Kronos Government; GAStech International,1.7058589458465576,620,33,News Online Today; ELODIS; 2005/09/25; Kronos; Protectors of Kronos; Kronos Government; GAStech International
384,0,"News Online Today; IN REMEMBRANCE:  THE DEATH OF ELIAN KAREL, A YEAR LATER; 2010/06/19; ABILA; Kronos; Elian Karel; 19 June",2.479531526565552,659,48,"News Online Today; IN REMEMBRANCE:  THE DEATH OF ELIAN KAREL, A YEAR LATER; 2010/06/19; ABILA; Kronos; Elian Karel; 19 June"
385,0,"News Online Today; Elian Karel; 2011/06/21; ABILA, Kronos; Abila; Elodis; Abila Chief of Police; POK",1.93543004989624,736,38,"News Online Today; Elian Karel; 2011/06/21; ABILA, Kronos; Abila; Elodis; Abila Chief of Police; POK"
386,0,News Online Today; KIDNAPPING AT GASTECH KRONOS; 2014/01/20; ABILA; Kronos; Kronos Government; GAStech International; Abila Fire Department; 10:00,1.9134740829467771,643,48,News Online Today; KIDNAPPING AT GASTECH KRONOS; 2014/01/20; ABILA; Kronos; Kronos Government; GAStech International; Abila Fire Department; 10:00
387,0,"News Online Today; GAStech; 2013/02/22; Kronos; Tethys; Europe; Sten Sanjorge, Jr; Black Sea; four planes",1.5068345069885254,732,38,"News Online Today; GAStech; 2013/02/22; Kronos; Tethys; Europe; Sten Sanjorge, Jr; Black Sea; four planes"
388,0,News Online Today; DRILLING TECHNIQUE BANNED IN TETHYS; 1995/03/30; CENTRUM; Tethys; GAStech International; Hyper Acidic Substrate Removal; HASR; Tethys government,2.23866605758667,593,53,News Online Today; DRILLING TECHNIQUE BANNED IN TETHYS; 1995/03/30; CENTRUM; Tethys; GAStech International; Hyper Acidic Substrate Removal; HASR; Tethys government
389,0,"News Online Today; KRONOS POLICE ARREST BLOTTER; ABILA; 2011/11/23; AWELON, CYNTHE; 3/20/1981; DRUG PARAPHERNALIA; BLUMIAU, WILLEM; 2/15/1995; POSSESSION OF CONTROLLED SUBSTANCE (HASHISH); PEDESTRN SUBJECT TO SIGNAL; CUSEMA, BRITA; 1/7/1992; THEFT SHOPLIFTING-5TH DEGREE; DUNNA, THAD; 9/20/1974; THEFT ALL OTHER-3RD DEGREE; GUDENZ, KEL; 7/2/1995; FAILURE TO MAINTAIN CONTROL",5.567090749740601,781,161,"News Online Today; KRONOS POLICE ARREST BLOTTER; ABILA; 2011/11/23; AWELON, CYNTHE; 3/20/1981; DRUG PARAPHERNALIA; BLUMIAU, WILLEM; 2/15/1995; POSSESSION OF CONTROLLED SUBSTANCE (HASHISH); PEDESTRN SUBJECT TO SIGNAL; CUSEMA, BRITA; 1/7/1992; THEFT SHOPLIFTING-5TH DEGREE; DUNNA, THAD; 9/20/1974; THEFT ALL OTHER-3RD DEGREE; GUDENZ, KEL; 7/2/1995; FAILURE TO MAINTAIN CONTROL"
390,0,News Online Today; POK; GAStech; 2009/02/19; ABILA; Kronos; Protectors of Kronos; Rufus Drymiau,1.667788028717041,668,36,News Online Today; POK; GAStech; 2009/02/19; ABILA; Kronos; Protectors of Kronos; Rufus Drymiau
391,0,News Online Today; Kapelou; POK; 2012/06/22; ABILA; Kronos,1.0967721939086914,597,24,News Online Today; Kapelou; POK; 2012/06/22; ABILA; Kronos
392,0,News Online Today; ELODIS; KRONOS; Petrus Gerhard; 1998/03/20; Homeland Illumination; Tiskele River; Elodis; Sten Sanjorge Sr; Hank Fluss; GAStech; Sanjorge Sr,2.6783077716827397,728,57,News Online Today; ELODIS; KRONOS; Petrus Gerhard; 1998/03/20; Homeland Illumination; Tiskele River; Elodis; Sten Sanjorge Sr; Hank Fluss; GAStech; Sanjorge Sr
392,1,Elodis; two markets; two hardware stores; one gas station,0.7645349502563477,580,14,Elodis; two markets; two hardware stores; one gas station
393,0,News Online Today; GAStech; Sanjorge; GAStech HQ; 2014/01/21; ABILA; Kronos; Centrum; Tethys; Sten Sanjorge Jr.,1.8136160373687744,629,45,News Online Today; GAStech; Sanjorge; GAStech HQ; 2014/01/21; ABILA; Kronos; Centrum; Tethys; Sten Sanjorge Jr.
394,0,News Online Today; ABILA; Kronos; 2012/09/08; Thursday; Karel; Protectors of Kronos; 2009,1.7692463397979736,627,32,News Online Today; ABILA; Kronos; 2012/09/08; Thursday; Karel; Protectors of Kronos; 2009
395,0,News Online Today; 2014/01/19; ABILA; Kronos; GAStech; GAStech-Kronos; Kronos capital building,1.8593661785125728,618,33,News Online Today; 2014/01/19; ABILA; Kronos; GAStech; GAStech-Kronos; Kronos capital building
396,0,News Online Today; GAStech International; 1993/03/13; ABILA; Kronos; President Araullo; Tethys; Tiskele Bend; Sten Sanjorge Jr.,1.6869497299194336,636,43,News Online Today; GAStech International; 1993/03/13; ABILA; Kronos; President Araullo; Tethys; Tiskele Bend; Sten Sanjorge Jr.
397,0,News Online Today; HANK FLUSS; GASTECH; 73; 2003/05/17; CENTRUM; Tethys; GAStech International; Centrum; Hank Fluss; Beatriz Fluss,2.206263780593872,620,49,News Online Today; HANK FLUSS; GASTECH; 73; 2003/05/17; CENTRUM; Tethys; GAStech International; Centrum; Hank Fluss; Beatriz Fluss
398,0,News Online Today; ANNIVERSARY OF PROTESTS; 2010/06/14; ABILA; Kronos; Elian Karel; Protectors of Kronos; POK; Hagar Awelon; Siopa; Government of Kronos,2.2256076335906982,631,52,News Online Today; ANNIVERSARY OF PROTESTS; 2010/06/14; ABILA; Kronos; Elian Karel; Protectors of Kronos; POK; Hagar Awelon; Siopa; Government of Kronos
399,0,"News Online Today; KRONOS GOVERNMENT; 1992/12/12; ABILA, Kronos; Government of Kronos; fossil-fuels",1.864143133163452,634,33,"News Online Today; KRONOS GOVERNMENT; 1992/12/12; ABILA, Kronos; Government of Kronos; fossil-fuels"
400,0,News Online Today; 2011/05/15; ABILA; Kronos; Protectors of Kronos; DRUG RELATED ARRESTS ON THE RISE,1.333209991455078,603,34,News Online Today; 2011/05/15; ABILA; Kronos; Protectors of Kronos; DRUG RELATED ARRESTS ON THE RISE
401,0,News Online Today; ELODIS; KRONOS; Petrus Gerhard; 1998/04/26; Homeland Illumination; Bodrogi; Henk Bodrogi; Wellness For All; Reynolds; Elodis,1.749023199081421,742,48,News Online Today; ELODIS; KRONOS; Petrus Gerhard; 1998/04/26; Homeland Illumination; Bodrogi; Henk Bodrogi; Wellness For All; Reynolds; Elodis
401,1,Reynolds; Elodis; Tiskele River; GAStech; Kronos; Kronesian community,1.3232715129852295,679,23,Reynolds; Elodis; Tiskele River; GAStech; Kronos; Kronesian community
402,0,News Online Today; GAStech; Kronos; 2014/01/19; ABILA; Ingrid Barranco; Ada Campo-Corrente; Orhan Strum; Willem Vasco-Pais; Sten Sanjorge Jr.,2.175876379013061,608,52,News Online Today; GAStech; Kronos; 2014/01/19; ABILA; Ingrid Barranco; Ada Campo-Corrente; Orhan Strum; Willem Vasco-Pais; Sten Sanjorge Jr.
403,0,News Online Today; PRESIDENT KAPELOU; 2000/10/02; ABILA; Kronos; President Dorel Kapelou II; Former President Luis Araullo,2.124671220779419,596,39,News Online Today; PRESIDENT KAPELOU; 2000/10/02; ABILA; Kronos; President Dorel Kapelou II; Former President Luis Araullo
404,0,News Online Today; EXPLOSION ROCKS GASTECH'S TISKELE BEND SITE; 2000/08/15; ABILA; Kronos; Rebecca Cato; 3 a.m.; Sunday; Elodis; GAStech International; Tiskele Bend,3.032104253768921,627,59,News Online Today; EXPLOSION ROCKS GASTECH'S TISKELE BEND SITE; 2000/08/15; ABILA; Kronos; Rebecca Cato; 3 a.m.; Sunday; Elodis; GAStech International; Tiskele Bend
405,0,News Online Today; RALLY SCHEDULED IN SUPPORT OF INCREASED GOVERNMENT ACCOUNTABILITY; 2012/04/10; ABILA; Kronos; Silvia Marek; Protectors of Kronos,1.807997226715088,595,45,News Online Today; RALLY SCHEDULED IN SUPPORT OF INCREASED GOVERNMENT ACCOUNTABILITY; 2012/04/10; ABILA; Kronos; Silvia Marek; Protectors of Kronos
406,0,News Online Today; POK; Siopa District; 2011/06/21; ABILA; Kronos; Protectors of Kronos; Abila,1.204418420791626,586,33,News Online Today; POK; Siopa District; 2011/06/21; ABILA; Kronos; Protectors of Kronos; Abila
407,0,News Online Today; POK; GAStech; 2014/01/20; ABILA; Kronos; Protectors of Kronos; Edvard Vann; Abila,1.8316006660461424,610,38,News Online Today; POK; GAStech; 2014/01/20; ABILA; Kronos; Protectors of Kronos; Edvard Vann; Abila
408,0,News Online Today; GASTECH; 2014/01/20; ABILA; Kronos; 6 hours; GAStech - Kronos; Edvard Vann; Kronos Police; Government; 17:00; 14 GAStech,2.0500752925872803,624,54,News Online Today; GASTECH; 2014/01/20; ABILA; Kronos; 6 hours; GAStech - Kronos; Edvard Vann; Kronos Police; Government; 17:00; 14 GAStech
409,0,News Online Today; Kronos; 2013/11/13; Shawn Pastorini; Abilia; GAStech; Abila,1.6263988018035889,679,28,News Online Today; Kronos; 2013/11/13; Shawn Pastorini; Abilia; GAStech; Abila
410,0,News Online Today; POK; 2009/03/08; ABILA; Kronos; Juliana; Kronos government; Saturday; Karel; Henk Bodrogi; POK campaign,1.7633700370788574,693,42,News Online Today; POK; 2009/03/08; ABILA; Kronos; Juliana; Kronos government; Saturday; Karel; Henk Bodrogi; POK campaign
411,0,News Online Today; POK; 2011/07/28; ABILA; Kronos; Rufus Drymiau,1.6531033515930176,598,26,News Online Today; POK; 2011/07/28; ABILA; Kronos; Rufus Drymiau
412,0,News Online Today; Activist Leader Karel Arrested for Tax Evasion; 2009/03/12; ABILA; Kronos; Elian Karel; Michale Kraft,1.8439671993255613,610,38,News Online Today; Activist Leader Karel Arrested for Tax Evasion; 2009/03/12; ABILA; Kronos; Elian Karel; Michale Kraft
413,0,News Online Today; 21 June 2009; ABILA; Kronos; Elian Karel; Silvia Marek; Protectors of Kronos; 19 June,1.5104758739471436,593,36,News Online Today; 21 June 2009; ABILA; Kronos; Elian Karel; Silvia Marek; Protectors of Kronos; 19 June
414,0,"News Online Today; SANJORGE JR.; GASTECH INTERNATIONAL; 2013/09/03; CENTRUM; Tethys; 52 years; Sten Sanjorge, Jr.; GAStech; 1961; Sten Sanjorge, Sr.; Monday; $3.75 billion",2.4963366985321045,622,65,"News Online Today; SANJORGE JR.; GASTECH INTERNATIONAL; 2013/09/03; CENTRUM; Tethys; 52 years; Sten Sanjorge, Jr.; GAStech; 1961; Sten Sanjorge, Sr.; Monday; $3.75 billion"
415,0,News Online Today; Ministry of Health; 1998/11/10; ABILA; Kronos; Cesare Nespola; Tiskele Bend; Elodis,1.577085256576538,614,36,News Online Today; Ministry of Health; 1998/11/10; ABILA; Kronos; Cesare Nespola; Tiskele Bend; Elodis
416,0,News Online Today; GASTECH; POK; 2009/02/19; ABILA; Kronos; GAStech International,1.2263226509094238,622,29,News Online Today; GASTECH; POK; 2009/02/19; ABILA; Kronos; GAStech International
417,0,News Online Today; GASTECH; ELODIS; 2007/03/21; Kronos; Elodis Primary School; Spring Program,1.1425368785858154,613,31,News Online Today; GASTECH; ELODIS; 2007/03/21; Kronos; Elodis Primary School; Spring Program
418,0,News Online Today; PRESIDENT KAPELOU II ELECTED BY RECORD MARGIN; 2010/10/03; ABILA; Kronos; President Dorel Kapelou II; Kronesian; President's Democratic Party of Kronos; General Assembly; Organization of Business and Unions Party; Party of Kronos Industrialists,2.9256350994110107,627,69,News Online Today; PRESIDENT KAPELOU II ELECTED BY RECORD MARGIN; 2010/10/03; ABILA; Kronos; President Dorel Kapelou II; Kronesian; President's Democratic Party of Kronos; General Assembly; Organization of Business and Unions Party; Party of Kronos Industrialists
419,0,News Online Today; POK; 2009/03/13; ABILA; Kronos; Elian Karel; Protectors of Kronos; Michale Kraft,1.851773738861084,620,35,News Online Today; POK; 2009/03/13; ABILA; Kronos; Elian Karel; Protectors of Kronos; Michale Kraft
420,0,News Online Today; POK; 2001/09/01; ELODIS; Kronos; Protectors of Kronos; Tiskele Bend; GAStech; Tiskele River; Elodis; Homeland Illumination; Griffith Mabel,1.991748094558716,690,53,News Online Today; POK; 2001/09/01; ELODIS; Kronos; Protectors of Kronos; Tiskele Bend; GAStech; Tiskele River; Elodis; Homeland Illumination; Griffith Mabel
421,0,"News Online Today; GRAND OPENING GASTECH; GASTECH-KRONOS; 1995/10/11; ABILA; Kronos; Sten Sanjorge, Jr.",1.6691510677337646,603,41,"News Online Today; GRAND OPENING GASTECH; GASTECH-KRONOS; 1995/10/11; ABILA; Kronos; Sten Sanjorge, Jr."
422,0,News Online Today; GASTECH; Kronos; 1994/09/24; ABILA; Tiskele Bend; GAStech International; Tethan fields,1.9199087619781492,617,36,News Online Today; GASTECH; Kronos; 1994/09/24; ABILA; Tiskele Bend; GAStech International; Tethan fields
423,0,"News Online Today; Tiskele Bend Gas Fields; 1996/03/14; ABILA, Kronos; Ministry of Interior; Tiskele Bend; Minister Sarto; GAStech",1.5818679332733154,620,41,"News Online Today; Tiskele Bend Gas Fields; 1996/03/14; ABILA, Kronos; Ministry of Interior; Tiskele Bend; Minister Sarto; GAStech"
424,0,News Online Today; Tiskele Bend Fields; 2001/08/31; ABILA; Kronos; GAStech; Protectors of Kronos; Drilling Poisoned Our Water; Remember Juliana; Juliana Vann; 1998,2.33393931388855,658,53,News Online Today; Tiskele Bend Fields; 2001/08/31; ABILA; Kronos; GAStech; Protectors of Kronos; Drilling Poisoned Our Water; Remember Juliana; Juliana Vann; 1998
425,0,News Online Today; 1997/04/24; ELODIS; Kronos; 25 km West of Abila; Elodis; Tiskele River; 20 km; Tiskele Bend; GAStech International,1.885741949081421,606,49,News Online Today; 1997/04/24; ELODIS; Kronos; 25 km West of Abila; Elodis; Tiskele River; 20 km; Tiskele Bend; GAStech International
426,0,News Online Today; POK; 2012/03/09; ABILA; Kronos; Protectors of Kronos; Vincent Kapelou; Minister of Health; President Kapelou,1.6456098556518557,587,40,News Online Today; POK; 2012/03/09; ABILA; Kronos; Protectors of Kronos; Vincent Kapelou; Minister of Health; President Kapelou
427,0,News Online Today; 12 August 2009; ABILA; Kronos; POK; Elian Karel,1.2603001594543457,641,24,News Online Today; 12 August 2009; ABILA; Kronos; POK; Elian Karel
428,0,News Online Today; Abila; 2012/06/21; Tuesday; Protectors of Kronos; the presidential manor; the presidential mansion; the capital building,2.043186664581299,661,35,News Online Today; Abila; 2012/06/21; Tuesday; Protectors of Kronos; the presidential manor; the presidential mansion; the capital building
429,0,News Online Today; POK; 2012/06/20; ABILA; Kronos; Protectors of Kronos; Elian Karel; 19 June 2009; Silvia Marek; Juliana Vann,1.9192817211151123,739,48,News Online Today; POK; 2012/06/20; ABILA; Kronos; Protectors of Kronos; Elian Karel; 19 June 2009; Silvia Marek; Juliana Vann
429,1,Elian,0.5592103004455566,545,2,Elian
430,0,"News Online Today; WELLNESS FOR ALL; GASTECH; KRONOS GOVT; 1998/11/14; ABILA, Kronos; GAStech International; Government of Kronos; Wellness for All (WFA)",2.559389591217041,592,50,"News Online Today; WELLNESS FOR ALL; GASTECH; KRONOS GOVT; 1998/11/14; ABILA, Kronos; GAStech International; Government of Kronos; Wellness for All (WFA)"
431,0,News Online Today; POK; Karel; 2009/03/13; ABILA; Kronos; Elian Karel; President; Protectors of Kronos; Elodis,1.5773894786834717,713,40,News Online Today; POK; Karel; 2009/03/13; ABILA; Kronos; Elian Karel; President; Protectors of Kronos; Elodis
432,0,News Online Today; Multi-Country Task Force; 2013/10/22; Interpol; methyldimethyl cathinone; MDMC; cotton candy; spice dreams; Tulip Blossom; Asteria; Tethys,2.021859169006348,681,51,News Online Today; Multi-Country Task Force; 2013/10/22; Interpol; methyldimethyl cathinone; MDMC; cotton candy; spice dreams; Tulip Blossom; Asteria; Tethys
433,0,News Online Today; Centrum; Tethan Gas Industry; 1982/10/03; Tethys; Sanjorge Gas company; Sten Sanjorge,1.521458625793457,732,36,News Online Today; Centrum; Tethan Gas Industry; 1982/10/03; Tethys; Sanjorge Gas company; Sten Sanjorge
433,1,Centrum,0.3902127742767334,555,2,Centrum
434,0,News Online Today; GASTech; Kronos; 2014/01/21; Protectors of Kronos; John Rathburn; American; Tethys; Tethan Ministry of Foreign Affairs,1.7665374279022217,662,42,News Online Today; GASTech; Kronos; 2014/01/21; Protectors of Kronos; John Rathburn; American; Tethys; Tethan Ministry of Foreign Affairs
435,0,"News Online Today; TAX MEASURE DEFEATED, POK EFFORTS STALLED; 2001/03/22; Abila; Kronos; Minister of Health Cesare Nespola; General Assembly",2.14986515045166,593,44,"News Online Today; TAX MEASURE DEFEATED, POK EFFORTS STALLED; 2001/03/22; Abila; Kronos; Minister of Health Cesare Nespola; General Assembly"
436,0,News Online Today; GASTECH LEADERSHIP CONFIRMED MISSING; 2014/01/20; ABILA; Kronos; Miriam Avila; GAStech International; Centrum; Tethys; 5 million cubic meters,2.0390915870666504,626,52,News Online Today; GASTECH LEADERSHIP CONFIRMED MISSING; 2014/01/20; ABILA; Kronos; Miriam Avila; GAStech International; Centrum; Tethys; 5 million cubic meters
437,0,News Online Today; Kronos; Protectors of Kronos; 2009/02/23; Abila; POK,1.6446516513824463,660,26,News Online Today; Kronos; Protectors of Kronos; 2009/02/23; Abila; POK
438,0,News Online Today; ABILA AIRPORT; 2014/01/20; ABILA; Kronos; Ravi Danisliau,1.503279685974121,622,29,News Online Today; ABILA AIRPORT; 2014/01/20; ABILA; Kronos; Ravi Danisliau
439,0,News Online Today; Grand Opening of the New GAStech Offices; 1995/10/11; ABILA; Kronos; President Sten Sanjorge Jr.; Minister Sarto; Sanjorge,1.7537546157836914,608,43,News Online Today; Grand Opening of the New GAStech Offices; 1995/10/11; ABILA; Kronos; President Sten Sanjorge Jr.; Minister Sarto; Sanjorge
440,0,News Online Today; 1993/02/03; ABILA; Kronos; President Luis Araullo,1.0196609497070312,598,22,News Online Today; 1993/02/03; ABILA; Kronos; President Luis Araullo
441,0,News Online Today; Minister Nespola; Oil; Gas Development; 1999/07/04; ABILA; Kronos; Minister of Health; Cesare Nespola; health care; clean water projects; health education; rural areas,1.9216437339782717,616,50,News Online Today; Minister Nespola; Oil; Gas Development; 1999/07/04; ABILA; Kronos; Minister of Health; Cesare Nespola; health care; clean water projects; health education; rural areas
442,0,"News Online Today; GASTECH; 2009/05/16; CENTRUM; Tethys; GAStech International; Sten Sanjorge, Jr.; Kronos; February 19; GAStech - Kronos' headquarters",2.3146183490753174,670,52,"News Online Today; GASTECH; 2009/05/16; CENTRUM; Tethys; GAStech International; Sten Sanjorge, Jr.; Kronos; February 19; GAStech - Kronos' headquarters"
443,0,News Online Today; ABILA; Kronos; GAStech International; 1993/09/20; East Pier; Abila's Deep Water Port,1.369392156600952,617,32,News Online Today; ABILA; Kronos; GAStech International; 1993/09/20; East Pier; Abila's Deep Water Port
444,0,News Online Today; GAStech; 2014/01/21; ABILA; Kronos; Abila police,1.1161713600158691,605,25,News Online Today; GAStech; 2014/01/21; ABILA; Kronos; Abila police
445,0,News Online Today; WELLNESS FOR ALL; ELODIS; 1998/11/15; Kronos; Wellness for All; Elodis,1.230685472488403,592,31,News Online Today; WELLNESS FOR ALL; ELODIS; 1998/11/15; Kronos; Wellness for All; Elodis
446,0,News Online Today; ELODIS PUBLIC HEALTH FACT SHEET 2002; 2002/05/25; ELODIS; Kronos; Elodis Community Health Center; Wellness for All; 1998,1.745718479156494,580,45,News Online Today; ELODIS PUBLIC HEALTH FACT SHEET 2002; 2002/05/25; ELODIS; Kronos; Elodis Community Health Center; Wellness for All; 1998
447,0,News Online Today; TRAFFIC ACCIDENT NEAR ELODIS; 2007/04/11; ABILA; Kronos; GAStech International; Elodis,1.4956870079040527,606,37,News Online Today; TRAFFIC ACCIDENT NEAR ELODIS; 2007/04/11; ABILA; Kronos; GAStech International; Elodis
448,0,News Online Today; GASTECH; 2014/01/20; ABILA; Kronos; 14; GAStech; Kronos Government; Edvard Vann; Protectors of Kronos,2.090747594833374,648,43,News Online Today; GASTECH; 2014/01/20; ABILA; Kronos; 14; GAStech; Kronos Government; Edvard Vann; Protectors of Kronos
449,0,"News Online Today; GASTECH; 1999/02/19; CENTRUM; Tethys; GAStech International; 1998; $110 million; Sten Sanjorge, Jr.",1.83252477645874,621,45,"News Online Today; GASTECH; 1999/02/19; CENTRUM; Tethys; GAStech International; 1998; $110 million; Sten Sanjorge, Jr."
450,0,News Online Today; Oil; Gas Development; General Assembly; 2001/03/18; ABILA; Kronos; 10%; 77; 23; Minister of Health Cesare Nespola; Health Care; Clean Water Projects; Health Education; Rural Areas,2.302032709121704,627,56,News Online Today; Oil; Gas Development; General Assembly; 2001/03/18; ABILA; Kronos; 10%; 77; 23; Minister of Health Cesare Nespola; Health Care; Clean Water Projects; Health Education; Rural Areas
451,0,News Online Today; 2010/06/21; ABILA; Kronos; Protectors of Kronos; POK; Abila police,1.2631220817565918,611,30,News Online Today; 2010/06/21; ABILA; Kronos; Protectors of Kronos; POK; Abila police
452,0,"News Online Today; Tomorrow Morning; 2014/01/19; ABILA; Kronos; 8 AM; Initial Public Offering; CEO; Sten Sanjorge, Jr.",1.5595250129699707,580,39,"News Online Today; Tomorrow Morning; 2014/01/19; ABILA; Kronos; 8 AM; Initial Public Offering; CEO; Sten Sanjorge, Jr."
453,0,"News Online Today; 1994/02/18; Centrum; Tethys; Sten Sanjorge, Sr.; GAStech International; 1961; Ingrid Sanjorge; Sten Sanjorge, Jr.",2.5028316974639893,640,50,"News Online Today; 1994/02/18; Centrum; Tethys; Sten Sanjorge, Sr.; GAStech International; 1961; Ingrid Sanjorge; Sten Sanjorge, Jr."
454,0,News Online Today; Minister of Health; 2001/06/15; ABILA; Kronos; Cesare Nespola; President Kapelou; Vincent Kapelou,1.533167839050293,609,37,News Online Today; Minister of Health; 2001/06/15; ABILA; Kronos; Cesare Nespola; President Kapelou; Vincent Kapelou
455,0,News Online Today; POK; Abila Police Headquarters; 2010/06/21; ABILA; Kronos; Protectors of Kronos; Abila,1.5571222305297852,644,34,News Online Today; POK; Abila Police Headquarters; 2010/06/21; ABILA; Kronos; Protectors of Kronos; Abila
456,0,"News Online Today; POK; Abila; 2013/12/16; ABILA, Kronos; Police; Adrien Carmen",1.5053727626800537,618,29,"News Online Today; POK; Abila; 2013/12/16; ABILA, Kronos; Police; Adrien Carmen"
457,0,News Online Today; POK; Kronos; 1998/11/15; ABILA; Protectors of Kronos; Cesare Nespola; Minister of Health; Elodis; 1990s,2.4082767963409424,610,45,News Online Today; POK; Kronos; 1998/11/15; ABILA; Protectors of Kronos; Cesare Nespola; Minister of Health; Elodis; 1990s
458,0,News Online Today; POK Anniversary Rally Ends in Riot; 2012/06/20; ABILA; Kronos; POK,1.463335037231445,620,28,News Online Today; POK Anniversary Rally Ends in Riot; 2012/06/20; ABILA; Kronos; POK
459,0,News Online Today; ELODIS PUBLIC HEALTH FACT SHEET 2004; 2004/05/30; ELODIS; Kronos; Elodis Community Health Center; Wellness for All; 1998,2.203037738800049,579,45,News Online Today; ELODIS PUBLIC HEALTH FACT SHEET 2004; 2004/05/30; ELODIS; Kronos; Elodis Community Health Center; Wellness for All; 1998
460,0,"News Online Today; KRONOS GDP ON THE RISE; 2000/01/15; ABILA, Kronos; gross domestic product; Kronos; 5.4%; fourth quarter of 1999; Bureau of Economics",1.8096940517425537,607,49,"News Online Today; KRONOS GDP ON THE RISE; 2000/01/15; ABILA, Kronos; gross domestic product; Kronos; 5.4%; fourth quarter of 1999; Bureau of Economics"
461,0,News Online Today; ELODIS; KRONOS; Petrus Gerhard; 1998/05/15; Kronos; Reese; Wellness For All,1.639824390411377,672,33,News Online Today; ELODIS; KRONOS; Petrus Gerhard; 1998/05/15; Kronos; Reese; Wellness For All
462,0,"News Online Today; Minister of Health; POK; 2012/03/08; ABILA, Kronos; Vincent Kapelou; Police",1.4376397132873535,584,31,"News Online Today; Minister of Health; POK; 2012/03/08; ABILA, Kronos; Vincent Kapelou; Police"
463,0,News Online Today; Gas Industry; 2012/02/21; Kronos; 20 years; Energy Minister Jules Jecovic; Oil and Gas Kronos; 15%; last year; 2012; 8%; .83m barrels of oil per day,2.2190237045288086,687,57,News Online Today; Gas Industry; 2012/02/21; Kronos; 20 years; Energy Minister Jules Jecovic; Oil and Gas Kronos; 15%; last year; 2012; 8%; .83m barrels of oil per day
464,0,News Online Today; 30 June 2013; President Kapelou; Protectors of Kronos; Kronos,1.1142990589141846,605,24,News Online Today; 30 June 2013; President Kapelou; Protectors of Kronos; Kronos
465,0,News Online Today; KAREL DEATH ANNIVERSARY; 2013/06/21; ABILA; Kronos; June 19th; Protectors of Kronos; Kronos government; Tiskele River; Elodis; Juliana Vann; 1998; benzene,2.346214532852173,664,62,News Online Today; KAREL DEATH ANNIVERSARY; 2013/06/21; ABILA; Kronos; June 19th; Protectors of Kronos; Kronos government; Tiskele River; Elodis; Juliana Vann; 1998; benzene
466,0,"News Online Today; HUGE IPO MAKES SANJORGE BILLIONAIRE; 2013/12/16; CENTRUM; Tethys; GAStech International; Sten Sanjorge, Jr.; GAStech - Kronos; $327.25 million; $96.25 million; CFO Ingrid Barranco; CIO Ada Campo-Corrente; COO Orhan Strum",4.297622442245483,628,84,"News Online Today; HUGE IPO MAKES SANJORGE BILLIONAIRE; 2013/12/16; CENTRUM; Tethys; GAStech International; Sten Sanjorge, Jr.; GAStech - Kronos; $327.25 million; $96.25 million; CFO Ingrid Barranco; CIO Ada Campo-Corrente; COO Orhan Strum"
467,0,"News Online Today; ELIAN KAREL DEAD IN KRONOS JAIL; 2009/06/20; ABILA, Kronos; Elian Karel; Friday; Abila City Prison; Protectors of Kronos; President's office; Minister of Justice; Chief of Police",2.623404026031494,648,60,"News Online Today; ELIAN KAREL DEAD IN KRONOS JAIL; 2009/06/20; ABILA, Kronos; Elian Karel; Friday; Abila City Prison; Protectors of Kronos; President's office; Minister of Justice; Chief of Police"
468,0,News Online Today; Araullo; 1995/11/22; ABILA; Kronos; Abila General Hospital; 1930,1.457841157913208,628,29,News Online Today; Araullo; 1995/11/22; ABILA; Kronos; Abila General Hospital; 1930
469,0,Tethys News; GAStech; 20 January 2014; 3:05 PM; P2o,1.238250494003296,610,25,Tethys News; GAStech; 20 January 2014; 3:05 PM; P2o
470,0,Tethys News; GAStech; 20 January 2014; 12:25 PM; capitol; Sten Sanjorge Jr.; Ingrid Barranca; Ada Campo-Corrente; Orhan Strum; Willem Vasco-Pais,2.272862672805786,648,54,Tethys News; GAStech; 20 January 2014; 12:25 PM; capitol; Sten Sanjorge Jr.; Ingrid Barranca; Ada Campo-Corrente; Orhan Strum; Willem Vasco-Pais
471,0,Tethys News; GAStech; 20 January 2014; Vann; POK; The police,1.048947811126709,588,24,Tethys News; GAStech; 20 January 2014; Vann; POK; The police
472,0,Tethys News; GAStech; 20 January 2014; The police,0.8892536163330078,602,18,Tethys News; GAStech; 20 January 2014; The police
473,0,Tethys News; GAStech; 20 January 2014; 3:40 PM,1.0035099983215332,613,21,Tethys News; GAStech; 20 January 2014; 3:40 PM
